{
  "schema": "evidence-cards/v1",
  "subject": "Physics",
  "node_ref": "PHY-11-MOTION-IN-A-PLANE-06",
  "cards": [
    {
      "card_id": "EV-PHY-11-MIP-06-001",
      "kind": "DEFINITION",
      "claim": "Average velocity is displacement divided by the corresponding time interval.",
      "quote": "The average velocity ( )v of an object is the ratio of the displacement and the corresponding time interval",
      "equation": "\\bar{\\vec v}=\\Delta\\vec r/\\Delta t",
      "acquisition_ref": "ACQ-7619DA28A2E58C099426",
      "locator": {
        "page": 9,
        "printed_page": "35",
        "section": "3.7.1 Position Vector and Displacement — Velocity"
      },
      "harvested_by": "agent-researcher-1",
      "harvested_at": "2026-09-26"
    },
    {
      "card_id": "EV-PHY-11-MIP-06-002",
      "kind": "DEFINITION",
      "claim": "Instantaneous velocity is the limit of the average velocity as the time interval approaches zero.",
      "quote": "The velocity (instantaneous velocity) is given by the limiting value of the average velocity as the time interval approaches zero",
      "equation": "\\vec v=\\lim_{\\Delta t\\to0}\\Delta\\vec r/\\Delta t=d\\vec r/dt",
      "acquisition_ref": "ACQ-7619DA28A2E58C099426",
      "locator": {
        "page": 9,
        "printed_page": "35",
        "section": "3.7.1 Velocity"
      },
      "harvested_by": "agent-researcher-1",
      "harvested_at": "2026-09-26"
    },
    {
      "card_id": "EV-PHY-11-MIP-06-003",
      "kind": "RELATION",
      "claim": "The velocity at any point is tangent to the path at that point, in the direction of motion.",
      "quote": "Therefore, the direction of velocity at any point on the path of an object is tangential to the path at that point and is in the direction of motion.",
      "acquisition_ref": "ACQ-7619DA28A2E58C099426",
      "locator": {
        "page": 10,
        "printed_page": "36",
        "section": "3.7.1 Velocity",
        "figure": "Fig. 3.13"
      },
      "harvested_by": "agent-researcher-1",
      "harvested_at": "2026-09-26"
    },
    {
      "card_id": "EV-PHY-11-MIP-06-004",
      "kind": "DEFINITION",
      "claim": "Average acceleration in the x-y plane is the change in velocity divided by the time interval.",
      "quote": "The average acceleration a of an object for a time interval ∆t moving in x-y plane is the change in velocity divided by the time interval",
      "equation": "\\bar{\\vec a}=\\Delta\\vec v/\\Delta t",
      "acquisition_ref": "ACQ-7619DA28A2E58C099426",
      "locator": {
        "page": 10,
        "printed_page": "36",
        "section": "3.7.1 Acceleration"
      },
      "harvested_by": "agent-researcher-1",
      "harvested_at": "2026-09-26"
    },
    {
      "card_id": "EV-PHY-11-MIP-06-005",
      "kind": "CONDITION",
      "claim": "The 1-D rule that velocity and acceleration lie along one line stops holding in 2-D or 3-D, where the angle between them can be anything from 0 to 180 degrees.",
      "quote": "Note that in one dimension, the velocity and the acceleration of an object are always along the same straight line (either in the same direction or in the opposite direction). However , for motion in two or thr ee dimensions, velocity and acceleration vectors may have any angle between 0° and 180° between them.",
      "acquisition_ref": "ACQ-7619DA28A2E58C099426",
      "locator": {
        "page": 11,
        "printed_page": "37",
        "section": "3.7 Motion in a plane"
      },
      "harvested_by": "agent-researcher-1",
      "harvested_at": "2026-09-26"
    },
    {
      "card_id": "EV-PHY-11-MIP-06-006",
      "kind": "WORKED_EXAMPLE",
      "claim": "NCERT Example 3.4: for a particle whose position r(t) is given (equation garbled in the PDF text; see equation field), find v(t), a(t) and the magnitude and direction of v at t = 1.0 s.",
      "quote": "where t is in seconds and the coefficients have the proper units for r to be in metres. (a) Find v(t) and a(t) of the particle. (b) Find the magnitude and direction of v(t) at t = 1.0 s.",
      "equation": "\\vec r=3.0t\\,\\hat i+2.0t^2\\,\\hat j+5.0\\,\\hat k",
      "acquisition_ref": "ACQ-7619DA28A2E58C099426",
      "locator": {
        "page": 11,
        "printed_page": "37",
        "section": "Example 3.4"
      },
      "harvested_by": "agent-researcher-1",
      "harvested_at": "2026-09-26"
    },
    {
      "card_id": "EV-PHY-11-MIP-06-007",
      "kind": "WORKED_EXAMPLE",
      "claim": "Result of NCERT Example 3.4: the acceleration is 4.0 m/s^2 along the y-direction.",
      "quote": "a = 4.0 m s–2 along y- direction",
      "acquisition_ref": "ACQ-7619DA28A2E58C099426",
      "locator": {
        "page": 11,
        "printed_page": "37",
        "section": "Example 3.4"
      },
      "harvested_by": "agent-researcher-1",
      "harvested_at": "2026-09-26"
    },
    {
      "card_id": "EV-PHY-11-MIP-06-008",
      "kind": "MISCONCEPTION",
      "claim": "Average speed is not the same as the magnitude of average velocity: it is greater than or equal to it, and equal only when path length equals the displacement magnitude.",
      "quote": "the average speed of an object is greater than or equal to the magnitude of the average velocity over a given time interval. The two are equal only if the path length is equal to the magnitude of displacement.",
      "acquisition_ref": "ACQ-7619DA28A2E58C099426",
      "locator": {
        "page": 20,
        "printed_page": "46",
        "section": "Points to Ponder 2"
      },
      "harvested_by": "agent-researcher-1",
      "harvested_at": "2026-09-26"
    },
    {
      "card_id": "EV-PHY-11-MIP-06-009",
      "kind": "QUESTION",
      "claim": "NCERT Exercise 3.17: for a particle whose position r(t) is given (equation garbled in the PDF text; see equation field), find v and a, and the magnitude and direction of v at t = 2.0 s.",
      "quote": "where t is in seconds and the coefficients have the proper units for r to be in metres. (a) Find the v and a of the particle? (b) What is the magnitude and direction of velocity of the particle at t = 2.0 s ?",
      "equation": "\\vec r=3.0t\\,\\hat i-2.0t^2\\,\\hat j+4.0\\,\\hat k\\ \\mathrm{m}",
      "acquisition_ref": "ACQ-7619DA28A2E58C099426",
      "locator": {
        "page": 22,
        "printed_page": "48",
        "section": "Exercises",
        "question_number": "3.17"
      },
      "question": {
        "exam": "NCERT Class XI Physics Part I textbook exercises",
        "year": 2026,
        "paper": "Chapter 3 Motion in a Plane, Exercises (Reprint 2026-27)",
        "question_number": "3.17",
        "has_figure": false,
        "answer_key_card_ref": "EV-PHY-11-MIP-06-010",
        "jee_tier": "NONE"
      },
      "harvested_by": "agent-researcher-1",
      "harvested_at": "2026-09-26"
    },
    {
      "card_id": "EV-PHY-11-MIP-06-010",
      "kind": "ANSWER_KEY",
      "claim": "NCERT answer to 3.17: (a) v(t) = 3.0 i - 4.0t j and a = -4.0 j (symbols garbled in the PDF text, see equation); (b) at t = 2.0 s, 8.54 m/s at 70 degrees with the x-axis.",
      "quote": "3.17 (a) v i j( ) ( . ɵ ɵ)t t = −3 0 4.0 ɵ ( ) ɵa jt = − 4.0 (b) 8.54 m s–1, 70° with x-axis.",
      "equation": "\\vec v=3.0\\hat i-4.0t\\hat j,\\ \\vec a=-4.0\\hat j",
      "acquisition_ref": "ACQ-79BE0D7ADECCC1DEB630",
      "locator": {
        "page": 3,
        "printed_page": "162",
        "section": "Answers, Chapter 3",
        "question_number": "3.17"
      },
      "harvested_by": "agent-researcher-1",
      "harvested_at": "2026-09-26"
    },
    {
      "card_id": "EV-PHY-11-MIP-06-011",
      "kind": "QUESTION",
      "claim": "NCERT Exercise 3.9: a cyclist goes from the centre of a 1 km radius park to the edge, along the circumference and back to the centre in 10 min; find net displacement, average velocity and average speed.",
      "quote": "A cyclist starts from the centre O of a circular park of radius 1 km, reaches the edge P of the park, then cycles along the circumference, and returns to the centre along QO as shown in Fig. 3.20. If the round trip takes 10 min, what is the (a) net displacement, (b) average velocity, and (c) average speed of the cyclist ?",
      "acquisition_ref": "ACQ-7619DA28A2E58C099426",
      "locator": {
        "page": 21,
        "printed_page": "47",
        "section": "Exercises",
        "question_number": "3.9",
        "figure": "Fig. 3.20"
      },
      "question": {
        "exam": "NCERT Class XI Physics Part I textbook exercises",
        "year": 2026,
        "paper": "Chapter 3 Motion in a Plane, Exercises (Reprint 2026-27)",
        "question_number": "3.9",
        "has_figure": true,
        "answer_key_card_ref": "EV-PHY-11-MIP-06-012",
        "jee_tier": "NONE"
      },
      "harvested_by": "agent-researcher-1",
      "harvested_at": "2026-09-26"
    },
    {
      "card_id": "EV-PHY-11-MIP-06-012",
      "kind": "ANSWER_KEY",
      "claim": "NCERT answer to 3.9: net displacement zero, average velocity zero, average speed 21.4 km/h.",
      "quote": "3.9 (a) O; (b) O; (c) 21.4 km h–1",
      "acquisition_ref": "ACQ-79BE0D7ADECCC1DEB630",
      "locator": {
        "page": 2,
        "printed_page": "161",
        "section": "Answers, Chapter 3",
        "question_number": "3.9"
      },
      "harvested_by": "agent-researcher-1",
      "harvested_at": "2026-09-26"
    },
    {
      "card_id": "EV-PHY-11-MIP-06-013",
      "kind": "QUESTION",
      "claim": "NCERT Exemplar 4.7: in 2-D motion with constant positive instantaneous speed, which statements are necessarily true?",
      "quote": "In a two dimensional motion, instantaneous speed v0 is a positive constant. Then which of the following are necessarily true? (a) The average velocity is not zero at any time. (b) Average acceleration must always vanish. (c) Displacements in equal time intervals are equal. (d) Equal path lengths are traversed in equal intervals.",